cluster,cluster_name,opening,reviewText,star_rating,helpfulness_votes,word_count,domain
4,Specific Identification,"I purchased this DVD player in June 2000. In August,","I purchased this DVD player in June 2000. In August, it started skipping  and freezing discs out of the blue. It also started acting very strangly on  just about any disc that had extra features (which covers about 99% of all  DVDs). I had it cleaned, and checked out by a local electronics store, but  they could find no problem with it and suggested I return it or purchase a  better one. I've noticed that it skips more often about an hour into  watching a movie. The player is usually pretty hot at this point, even if  placed in a well open space. If I turn it off for an hour or two, and let  it cool off, the skipping would stop - until the next time it got too hot.  This is just not acceptable.
Samsung was my first DVD player, and I'm not  happy with it at all anymore. I got it because of the low price, but I  guess that old saying of ""you get what you pay for"" is true.  Buyer beware on this one. I suggest spending a few extra bucks, and going  with another brand. It'll save you the frustration of wanting to throw the  thing out the window when it starts freezing and skipping in the middle of  a movie you're enjoying very much.",1.0,13.0,221,Electronics
4,Specific Identification,Search the Seagate community forum on this one. It will,"Search the Seagate community forum on this one.  It will simply disappear from your BIOS at ramdom intervals and give you the blue screen of death.  I fixed all my PC problems by replacing this drive.
  Don't waste your time and money on this one.",1.0,2.0,45,Electronics
4,Specific Identification,"I bought a belkin router, and it kept disconnecting me","I bought a belkin router, and it kept disconnecting me every few hours.  I returned it to get this linksys rounter.
It is very easy.  Plug in the power, cable modem line, and line to the computers and your set.  This also gives a lot of options that admins might like, such as denial of internet access to ceratin accounts.
I also like it because it is slim, and fits right in my computer table.  The lights are logical, and i do not notice a loss in performance with other computers online.
This also comes with a built-in firewall that prevents most attacks.  The firewall also does not interfear with anything, so its a added bonus.
~hope this helps",5.0,3.0,119,Electronics
4,Specific Identification,"First of all, this product charges my Garmin 1450 very","First of all, this product charges my Garmin 1450 very slowly. I had it plugged in using this device for 3 hours and it still was not fully charged. You may as well use the blackberry cell cord to charge; it also takes this long to charge the device. The car charger will charge the 1450 fully in about 1 hour. Waste of my money.",1.0,7.0,65,Electronics
4,Specific Identification,How'd I ever miss this one? Hell at the Breech,"How'd I ever miss this one?

Hell at the Breech is the best book I've read in a while. The believable tale of a county sheriff who gets ground up between the abrasive forces of two opposing factions. Billy Waite, the sheriff, has honest compassion for each side. A case of an accidental death masquerading as a murder. Events just get out of hand.

Has the flavor of the times down pretty darn good. I had feelings for just about everyone represented in the novel, except for the cowboy wannabe. He performed nothing but bad deeds. I'm talking about dire. Franklin handled the lingo right smartly.

If I have anything to bitch about in this novel is that Franklin for some reason decided to give it the smell and flavor of a Western. In Alabama? Why? Other than that, the novel was great.

A Faulkner feed on a high school diet. Good 'nuff fer me.

Not enough stars in the skies for this one.

Extra-special read.",5.0,3.0,166,Books
4,Specific Identification,I've been using the eTrex for about 2 months. All,"I've been using the eTrex for about 2 months.  All GPS functions work marvelously.  However, the PC cable is a 9 pin female serial connector.  I haven't had a computer with this kind of connector for over 7 years.  Since I wanted to download my datapoints to a navigation program, I bought a ""Serial to USB"" connector from Radio Shack for $40.  After installing the connector's software, my laptop recognized the connector cable, but not the eTrex connected to it.  Best bet is probably to go with the Garmin cable for $60.  Which is outrageously priced.  Why they can't catch up with the real world of USB connectors is a mystery.  For handheld navigation though, it excels.",4.0,10.0,117,Electronics
4,Specific Identification,"I've been using Case Logic ""wallets"" to store my films","I've been using Case Logic ""wallets"" to store my films for several years now and am very pleased.  While it is true that the system that holds the pages can be a pain when you need to re-arrange your CDs or DVDs, it is in every other way a huge improvement over the typical 3-ring binder.  These pages WILL stay in place and never tear, come hell or high water.

I have five 336-disc cases and three of the 216-disc cases (and three 3-ring binders which I am replacing- I really dislike them).  It's a tough call deciding which size wallet to choose, assuming you need the storage; it's difficult to turn down the extra space as they sell for about the same price.  This is a significant cost difference, as two of the larger cases hold more discs total than three of the smaller ones. But the larger one is a bit cumbersome and awkward and it can be difficult to get started opening the zipper.  The 216-disc case is clearly easier to open, close, carry, and work with.

But both are excellent products.  They show no wear and tear after years, and there is no other system that can safely pack more films into so little space.  If my cases were full, I would have over 2300 DVDs on 40 inches of shelf space- that's more than 50 DVDs per inch!!  [NOTE: These numbers assume that you are not using up space in the case for cover art or any of the material that accompanies store-bought music or films.]

UPDATE: September 3, 2012- I can't believe almost five years have passed since writing this review! But I wanted people to know that five years on, the cases are in exactly the condition they were when I bought them.  Definitely a great product!",4.0,5.0,304,Electronics
4,Specific Identification,The Hardenbergs had limited means. The Seven Years War was,"The Hardenbergs had limited means.  The Seven Years War was expensive.  In 1788, when Fritz was nearly seventeen, Bernhard was born.  Erasmus was fourteen.  The father was the director of the salt mines.

In 1790 Fritz matriculated at the University of Jena.  On the first morning he attended a lecture by Fichte on Kant.  Fichte was the son of a linen weaver.  Fritz's history teacher was Professor Schiller.  In 1791 Fritz went to Leipzig.  After Leipzig and Wittenberg, Fritz was to be a trainee-clerk at the salt mines.  Fritz thought he could not endure life as a copying clerk.

Fritz wrote to Erasmus at the school of forestry.  He had fallen in love with a twelve year old girl, Sophie.  He had to go home for Christmas because Bernhard wanted to see him.  On his way home he was marooned in a snow storm.  He obtained permission to exchange letters with Sophie.  Sophie von Kuhn was being painted by a miniaturist.  Before starting work, Fritz went to see Caroline Schlegel and his other friends at Jena.

Sophie had a pain on her side.  She had tuberculosis of the hip.  At Weissenfels the Hardenbergs had a party.  Sophie and her father arrived.  Sophie had three operations.  Fritz's father was so moved by the physical suffering of Sophie that he gave her, illegally, a family property.  Sophie died two days after her fifteenth birthday.

Afterwards, Fritz wrote under an old family name, Novalis.",5.0,7.0,241,Books
4,Specific Identification,"Luckily for me, this is the first Madeleine Brent book","Luckily for me, this is the first Madeleine Brent book I read and also the first one that he/she wrote.

It got me hooked on his/her writing. Of course after you have read the next few books, you see that there is a definite pattern to his/her work. A heroine who is alone, friendless but with lots of spirit who manages to prevail over great adversity.

Part of the joy of reading a brent are the exotic locales although this book is set primarly in Britain. A unique writer who is head and shoulders above the rest.",5.0,6.0,97,Books
4,Specific Identification,That's what this book makes me think of. Edna St,"That's what this book makes me think of.  Edna St Vincent Millay wrote life is not one damn thing after another, it's the same damn thing over and over again. As for Perry Mason he was fond of objecting ""incompetent, irrelevant, & immaterial.  I think that pretty much sums up this book.  Unless of course you want to drag in JK Rowling who after her third book either fired her editor, or thought she was being paid by the word.  I see a distinct similarity.  Perhaps they both caught their hubris from Oedipus.",2.0,2.0,93,Books
5,Affective Stance,We got this to load up our DVD's into instead,"We got this to load up our DVD's into instead of trying to keep all the plactic cases organized in some kind of tower/shelving unit.  The main reason we did this was because our kids loved dispersing the dvd cases all over the room whenever they could.  We found that the dvd's fit easily into the sleeves, and that the case easly fit all the discs at full capacity.  We have noticed that the thing gets quite heavy when it's fully loaded, so it's not something you would want to put somewhere hard to get to, or where you might need to pull/access it from an awkward angle.  We also were a bit nervous getting rid of all our plastic dvd cases, but once we took the plunge, we haven't looked back.  We never referred to the chapter listings they provide in the case, and now, as soon as we buy a dvd, we immediately just remove the disc(s), place them in their new home - the nice case, and trash the rest of the packaging.  If more than half full, you really can't stand the case up on any of its edges without some kind of support, as the weight will work towards bending the sides of it and eventually making it collapse.  The kids have climbed all over it and it hasn't torn or become unfunctional, however the front and back have gotten creased from the kids playing with it/using it as a seat.  One thing to note, it that the inside cover disc holders, the ""quick access"" ones, start off very tight and makes it fairly difficult to remove if you slide the discs all the way down inside each space.  I am sure they would stretch with some time and use, but we never put many discs in them and they have remained a fairly tight fit.  All in all, a good case, and better than the DVD specivic case which has a spot for the cover art/chapters.  Who starts a movie in the middle and needs to refer to those instead of the on-screen chapter listing anyway?  We just opted for the regular CD/DVD pages and it has worked great for us!",4.0,2.0,367,Electronics
5,Affective Stance,I couldn't be happier with my Pentax 50mm lens and,I couldn't be happier with my Pentax 50mm lens and the proof is in the photos. It's worth every cent.,5.0,10.0,20,Electronics
5,Affective Stance,I was excited to begin my first Agatha Christie book,"I was excited to begin my first Agatha Christie book after hearing so much about her.  My 1973 hardback was picked up at a book sale.  I'm so glad that I read some reviews here to find that this is not representative of her work.  The plot has a resemblance to the TV show ""Cold Case"" in that it tries to figure out a crime from the past.  However, unlike the TV show, there are no flashbacks; so the past remains removed from the reader.  For each clue and discovery that either Tuppence or Tommy make, they seem to communicate it very imprecisely to the other, exactly the opposite of what I would think would make good detective work.  I kept hoping that the ending of the book would tie it together.  Although there was somewhat of an explanation about who the criminals were in the past and in the present, none of it was particularly clear or interesting.  Hannibal the dog was fun.  I think I will try to find an earlier work of hers, but my recommendation on this book is to pass.  Taxi!",1.0,2.0,186,Books
5,Affective Stance,I am not sure if Martin has simply lost interest,"I am not sure if Martin has simply lost interest in this project, has become distracted, or simply been overwhelmed...Or if editors have helped or hindered him. Though, I think it is telling that one of his editors admits he's left a book's worth of material on the cutting room floor.

The book somehow manages to feel both too meandering and too rushed at the same time. And I can't help but feel that some of his experience in writing scripts for the HBO series has rubbed off on how he writes the books. In fact, I'm certain of it.

If so, we're all the poorer for it.

I can't imagine events being wrapped up in two books, given what he chose to spend so much time on in this one...and we'll have to wait ten years to find out.

Martin was probably a bit too cruelly gratuitous in his cliffhangers. Reading this book might be a much different experience as part of a completed series, but taken alone, is painful, and not as re-readable as the first 3 books.",2.0,29.0,180,Books
5,Affective Stance,Very good lens for your DSLR if you don't want,Very good lens for your DSLR if you don't want to pay a lot of money for a Telephoto Lens.,5.0,2.0,20,Electronics
5,Affective Stance,I much prefer Sci-fi to fairy tales and downloaded this,"I much prefer Sci-fi to fairy tales and downloaded this to see if the kids would like it. THis book was written over 100 years ago but it is very understandable and engaging. I was very pleasantly surprised and unable to stop reading until I had finished the book. Although there are some aspects of fairy tales, the books characters and plot feel original.

Young Princess Irene is a typical little girl, very curious and precocious with a big heart, although being a princess, she does not lie and is well-behaved. She makes friends with a miner boy who saves her from the goblins when she accidently stays out too late, but can he save her from their plot to kidnap her?

After reading this, I am surprised that I had never before heard of George MacDonald. I will be reading more of his works.",5.0,10.0,145,Books
5,Affective Stance,I purchased this to listen to podcasts off my BlackBerry,"I purchased this to listen to podcasts off my BlackBerry Curve 8330 (Sprint).  I have found that the sound quality varies from podcast to podcast due to the level of compression used.  Generally I turn my BlackBerry up to full volume and almost do the same in my car stereo.  The sound quality is ok - it is a cassette after all.  The cord is not very thick so you need to be careful not to snap it or pull on it roughly.  I might try another adapter to see if there is any difference in sound quality.

Also, the Dolby noise reduction is a must, otherwise you will get a lot of hissing.  I would say overall the purchase was positive, perhaps my expectations were a bit too high.",3.0,2.0,130,Electronics
5,Affective Stance,So of course it thrills my heart that my two,"So of course it thrills my heart that my two nieces (2.5 and 5) like it too.

This book is really an early reader, it's not *intended* for children under that age, though of course it can function as a read-aloud for little-little ones. (Not always - my younger niece won't always sit through this one, it's a bit long!)

There are two running plots in the book, one about hats, and one about where the dogs are all ultimately going; these two plots meet marvelously at the end of the book. (For *months*, I couldn't go a day without having to re-enact ""Do you like my hat? I do, I like that hat, what a party hat!"" with the older niece!)

Most of the book, however, is caught up with just basic vocabulary words, mostly about dogs - ""One dog going in, three dogs going out"" or ""The sun is up, the sun is yellow, the yellow sun is over the house"".

This can be a little tedious, but I the kids don't seem to think so - even at their fidgiest, they want me to say every word.",4.0,3.0,190,Books
5,Affective Stance,Victoria Holt was one of my favorite authors when I,"Victoria Holt was one of my favorite authors when I was younger. A master storyteller, she would consistently weave a story that would have the reader turning the pages. This work of historical fiction is one of her best. Riveting from beginning to end, this fictional autobiographical account of the life of Marie Antoinette is superb. Written in the first person, with little dialogue, it is the rumination of a life that was to end tragically. Pampered, spoiled, and fun loving, the beautiful Maria Antonia of Austria metamorphosed into Marie Antoinette of France upon her marriage to the Dauphin, who would eventually become King of France, the ineffectual, but benign, Louis XVI.

This is her story, grounded in historical fact and set within the framework of history. This work of fiction about the life of Marie Antoinette, as seen through her own eyes, is fascinating, as it captures the flavor of those uncertain times and the events that led to the French Revolution and the end of the monarchy in France. It is a reflection on how Marie Antoinette's own behavior influenced the fate of France. Indulging in the excesses of the day, she initially gave little thought as to how her actions might affect the people of France or the monarchy. By the time she realized that her actions and excesses had wide spread political ramifications, it was too late, and the fate of her and her husband was sealed. No amount of personal regret could change it.

This book will be enjoyed by those who enjoy good, well written historical fiction. It is little wonder that this book spent two months on the New York Times Best Seller List. It is simply historical fiction at its best.",5.0,2.0,289,Books
5,Affective Stance,Roget's Thesaurus is for anyone who is serious about writing.,Roget's Thesaurus is for anyone who is serious about writing. It is a perfect addition to one's home reference library.,5.0,2.0,20,Books
6,Contextual Framing,The only problem I have with this is that it,The only problem I have with this is that it reads too much like a soap opera script instead of a real story.,4.0,2.0,23,Books
6,Contextual Framing,Lord Fouls Bane is the start of a true classic,"Lord Fouls Bane is the start of a true classic fantasy series. Oh yeah, it's not for everybody.
I read this series when it was first released, after I finished ""Lord of the Rings"" for the 3rd time.  Anyway, I was expecting another LOTR type of story, but what I got was something completely different, very mature and very visceral. There aren't any pretty elves, funny dwarves or omniscient wizards, there are just people and strange beings with very strange abilities, trying to cope with tragedy and pure evil. The main character is an emotional cripple who also happens to be physically crippled by leprosy.  He can't accept his situation and his role, because to do so risks the progression of his disease.

For many people, getting through the first book is not easy, it requires patience and acceptance of the main character (something that is also required of the characters in this story).  Donaldson knows how to ratchet up the suspense and horror in a situation. The bad guys are brutal, vicious and believe in causing unbelievable pain to a person's soul -- there are some unforgettable chapters in this series that will stay with you forever. This fantasy series was ahead of its time when it came out in the late 70s and once you read it you will see how other authors have been influenced by it.

The payoff is in the next two books The Illearth War and the Power That Preserves. The main character's actions in the first book have repercussions in the next two books. I've read the series a few times and always looked at the first book as a necessary evil to get to the next two books.

It's a story about tragedy and redemption--Donaldson believes that people can change.",5.0,5.0,298,Books
6,Contextual Framing,This is a well made bag which can carry most,"This is a well made bag which can carry most all of your camera needs.  I found it works well to carry on my camera on airplane trips.  I can pack 3 lenses and a slr camera body.  Room for accessories and a way to strap on a small tripod makes this a good bag for hiking.

Well worth the cost for the value.",4.0,2.0,64,Electronics
6,Contextual Framing,That Hollywood hasn't scratched the surface of the depth of,"That Hollywood hasn't scratched the surface of the depth of Dracula's evil is a true testament to the stridence of this piece of great literature. Stoker's novel paints a much more brutal and erudite picture of Dracula than the movies have ever managed. Perhaps because, for some lowbrow pop culture reason, vampires are regarded as vessels of fashion first, at the expense of their potential menace and depth. We're more likely to see washboard stomachs and deep tans than we are to see anything resembling the eerily esoteric Count. Perhaps Stoker's character is simply too mysterious to be duplicated on screen, or perhaps Hollywood is too illiterate, or both.

For the uninitiated, the novel's surmounting terror lurches forward in the past tense, as told through correspondence. Steven King and William Peter Blatty have undoubtedly drawn much inspiration from this, as implied horror is most often the most horrifying of all. Readers might find some other stories more frightening, but they'd be hard-pressed to find anything more genuinely creepy. Dracula's evil might surprise even fans of the film genre. Don't expect to be comforted by pretty boys in Gucci.",5.0,3.0,188,Books
6,Contextual Framing,You can see other positive reviews of the etrex Legend,"You can see other positive reviews of the etrex Legend here, so I won't rehash them. The short story is that the Legend is a pretty decent GPS unit that works pretty well.
The base map included in the Legend only shows major highways and major streets. This is similar to the maps you get from a car rental agency. It's perfectly fine for doing rough navigation from city to city. At first, I tried using Rand McNally's StreetFinder and TripMaker Deluxe on my laptop with the Legend. The setup worked, but having to deal with the serial cable and using a laptop in the car was not very practical.
After I've had my Legend a while, I had a chance to borrow and use a Vista. The owner of the Vista upgraded it with detailed street-detail maps from Garmin's MapSource ""Metroguide USA"" CD .... The detailed street map is a really nice feature -- especially because you can look up addresses. Having such a detailed map in a small portable device is a delight! I decided to get the Metroguide for myself.
From my usage comparison, I found two things missing in the Legend compared to the top-end etrex Vista.
First, the Legend has only 8 MB of expansion memory instead of the 24 MB in the Vista. This turns out to be a big issue for me, as I would like to have a complete metro guide of the greater Los Angeles area. With 8 MB, I could only fit 6 of the 18 MetroGuide map sets that I would have liked. This means, I am missing coverage of a large section stretching roughly from Compton to Long Beach to Lynwood to Cerritos to Irvine that I would have wanted. In contrast, the Vista held all of greater Los Angeles area, plus some San Francisco, San Diego, and Las Vegas.
Second, the Vista has sensors for barometric altitude and magnetic compass heading. The Legend estimates altitude via GPS, and calculated heading based on your travel speed vector. If you are a trail-hiker, these sensors improve your navigation.
Used as-is from the factory (i.e., only the American basemaps), the Legend is perfectly fine, and I was quite happy with it.
I could live without the Vista's sensors;
But, having hit the 8 MB memory limit (trying to load Los Angeles), I would definitely go with the Vista now.
The Metroguide maps sizes of other cities may or may not be an issue for you. Go to the Garmin website and use their MapSourec Map Viewer and count the number of ""yellow squares"" you'll need to cover you area of interest. Each square roughly represents between 500K to 1.5 MB of data (with the smaller, ""dense"" squares being toward the 1 MB to 1.5MB size). You'll find that most of the big cities will have enough squares to easily exceed the 8 MB of the Legend.",4.0,468.0,486,Electronics
6,Contextual Framing,This book was given to me by a friend who,"This book was given to me by a friend who thought I might enjoy it.  She was right, though this book isn't exactly what I was expecting.  The author uses the framework of a visit by the Virgin Mary to explore a number of historical and philosophical themes.  How are truth, fact and story related, and how do they impact what we think of as history?  What is the role of doubt in faith?  How is our image of ourselves based on how we view our life story?  These are just some of the themes the narrator reflects on.  In addition, this book describes the stories of many of the Marian appearences, together with the stories of many saints where Mary plays a role.  Overall, this book serves as a collection of interesting stories while providing a great deal of material for further reflection and thought.",4.0,5.0,146,Books
