cluster,cluster_name,opening,reviewText,star_rating,helpfulness_votes,word_count,domain
6,Contextual Framing,I'm very surprised that this book is no longer in,"I'm very surprised that this book is no longer in print.  I thought every scrap of paper that Christie might have scribbled a few lines on is in print somewhere.  I suppose you could view these short stories about Mr. Quinn as a failure, because Christie stopped writing them early on.  I found them quite interesting, though, with their mysteries tinged with supernatural overtones.  If you can track down a copy, any Christie fan will not be disappointed.",4.0,2.0,78,Books
6,Contextual Framing,this really wasn't that bad.advise to george:finish the series.you're not,this really wasn't that bad.advise to george:finish the series.you're not young.you're going to die before you finish this series.you might want to get in touch brandon sanderson.,1.0,9.0,27,Books
6,Contextual Framing,The glossy covers have started gatting small white spots all,"The glossy covers have started gatting small white spots all over the pictures, and I have only used it for no more than 6 Month. BAD QUALITY, don't buy!!!",1.0,7.0,29,Electronics
6,Contextual Framing,I had been sitting on the fence about getting an,"I had been sitting on the fence about getting an optical mouse for quite some time. It is really hard to justify buying a $70 mouse; specially when there are so many models available.
I had been trying different models for several months and have to admit that this one not only feels right due to the ergonomic shape for right-hand use, it is well built.
Some other features I like is that it has 800 DPI (dots per inch) resolution, which makes it very acurate.
The short setup instructions are a must read, specially to have the wireless base detect the mouse. Luckily they are straight forward and easy (although small print) to read.
I have not yet tested this mouse for gaming but so far the response time is very fast (under Win2K using the USB port.) The instructions also point out that it works best on light matte surfaces, which might explain the complaints from other reviewers; it works just fine on printed fabric also.
Another feature I like is the third button close to the base. (the desk.) This makes it easier to grab the mouse without having to be overly cautions about clicking extra buttons like some models from the competition.
Highly recommended!",5.0,9.0,208,Electronics
7,Terse Evaluation,Well edited and well brought out on high quality paper.,"Well edited and well brought out on high quality paper.
However, when you consider buying a complete Shakespeare, think whether you want one with explanatory footnotes or not. If you do, buy the Norton or Pelican edition. If you want the bare text, buy the Oxford or Arden, which have a brief lexicon in back.",4.0,3.0,55,Books
7,Terse Evaluation,"As You Like It boasts one of Shakespeare's most vivid,","As You Like It boasts one of Shakespeare's most vivid, romantic, and just plain fun heroines, Rosalind.  She breaks all the rules and then makes up her own; she fools her true love into wooing her while he is absolutely  unaware of who she is.
Then there's Jaques.  Melancholy, cynical, yet  hysterical in his own way; pay special attention to his ""All the  world's a stage"" speech at the end of Act III.  And don't forget  Touchstone, the fool...
I don't want to give the plot away.  There are so  many surprises, so many unexpected twists-- this is one of Shakespeare's  more complicated (if not deeper) plays.  If at all possible, try to see at  least one performance of it.  The one I most recently saw had the entire  audience in stitches from the first act to the final, multiple weddings and  all.",5.0,2.0,143,Books
7,Terse Evaluation,"Junk, Only one ethernet port worked. Tech support sucked. Will","Junk, Only one ethernet port worked.  Tech support sucked.  Will stay away from net gear.  Purchased a china model for 10.00 cheaper and it works great.",1.0,2.0,26,Electronics
7,Terse Evaluation,"Louisa May Alcott wrote many books, but ""Little Women"" retains","Louisa May Alcott wrote many books, but ""Little Women"" retains a special place in the heart of American literature. Her warmly realistic stories, sense of comedy and tragedy, and insights into human nature make the romance, humor and sweet stories of ""Little Women"" come alive.

The four March girls -- practical Meg, rambunctious Jo, sweet Beth and childish artist Amy -- live in genteel poverty with their mother Marmee; their father is away in the Civil War. Despite having little money, the girls keep their spirits up with writing, gardening, homemade plays, and the occasional romp with wealthier pals. Their pal, ""poor little rich boy"" Laurie, joins in and becomes their adoptive brother, as the girls deal with Meg's first romance, Beth's life-threatening illness, and fears for their father's safety.

The second half of the book opens with Meg's wedding (if not to the man of her dreams, then to the man she loves). Things rapidly go awry after the wedding, when Laurie admits his true feelings to Jo -- only to be rejected. Distraught, he leaves; Amy also leaves on a trip to Europe with a picky old relative. Despite the deterioration of Beth's health, Jo makes her way into a job as a governess, seeking to put her treasured writing into print -- and finds her destiny as well.

There's a clearly autobiographical tone to ""Little Women."" Not surprising -- the March girls really are like the girls next door. Alcott wrote them with flaws and strengths, and their misadventures -- like Amy's embarrassing problem with her huge lobster -- have the feeling of authenticity. How much of it is real? A passage late in the book portrays Alcott -- in the form of Jo -- ""scribbling"" down the book itself, and getting it published because it feels so real and true.

Sure, usually classics are hard to read. But ""Little Women"" is mainly daunting because of its length; the actual stories flow nicely and smoothly. Don't think it's just a book for teenage girls, either -- adults and boys can appreciate it as well. There's something for everyone: drama, romance, humor, sad and happy endings alike.

Alcott's writing itself is nicely detailed. While certain items are no longer in common use (what IS a charabanc anyway?), Alcott's stories themselves seem very fresh and could easily be seen in a modern home. And as nauseating as ""heartwarming"" stories sometimes are, these definitely qualify. Sometimes, especially in the beginning, Alcott is a bit too preachy and hamhanded. But her touch becomes defter as she writes on.

Jo is the quintessential tomboy, and the best character in the book: rough, gawky, fun-loving, impulsive, with a love of literature and a mouth that is slightly too big. Meg's love of luxury adds a flaw to the ""perfect little homemaker"" image, and Beth just avoids being shown as too saintly. Amy is an annoying little brat throughout much of the first half of the book, but by her teens she's almost as good as Jo.

""Little Women"" is one of those rare classic novels that is still relevant, funny, fresh and heartbreaking today. Louisa May Alcott's best-known novel is a magnificent achievement.",5.0,92.0,530,Books
7,Terse Evaluation,"FOR PETE'S SAKE! THIS IS NOT A 3, 4 OR","FOR PETE'S SAKE!  THIS IS NOT A 3, 4 OR 5 STAR BOOK!!!!  At best it is a 2 star book.  Yes, it has a plot.  YEA!!!!!!!  Yes, Anita manages to get out of the bedroom.  YEA!!!!!!( THAT'S THE ONLY REASON FOR THE 2 STARS). That's where it ends.  If she's not having sex, she's mostly talking about sex.  LKH has thrown former characters in like confetti.  Yes the cops make an apperance.  For like 5 pages(takes longer for the badly written sex).  Yes Cheri makes an appearance and it's a very short one.  The editing, again, SUCKS.  Writers usually improve over time, but for some reason, give them a hard back, more money and the author thinks they are entitled to insult their readers writting what should be tossed.  I mean, do you really want to ready about Belle Morte having sex with Anita?  Do you really want to read about Anita having sex with a swan?  AND YES, THE FEATHERS DO LITTERALY FLY!  Sorry, but I don't do beastiality.  If one of my favorite authors released one book I don't care for, that's ok.  But, when there's 3 books that are bad and no end in sight, I just don't think so.  I was teased by the offer of a plot and was stupid enough to bite.  NO MORE!  I've had it with the series and with her.  If I want to read erotica, and I do read it sometimes,  I'll buy something that's at least written very well.  Kudo's to LKH.  Lost another one.",2.0,48.0,257,Books
7,Terse Evaluation,Majority of tapes were of low quality. Used in three,Majority of tapes were of low quality.  Used in three different VCRs and tapes recorded with poor quality and played off track.  The edges were dragging onto bottom of case.  Probably old stock.  Not cost effective to return.  Thrown away.  Will buy local in the future.,2.0,2.0,46,Electronics
7,Terse Evaluation,It is unclear to us why Chris experienced formatting problems.,"It is unclear to us why Chris experienced formatting problems. Amazon
product pages sometimes mix reviews for several books with identical title. Maybe this review belongs to a book published by another publisher. In any case we assure you that MobileReference book does not have any formatting errors. The MobileReference book was carefully checked for accuracy and completeness by a team of experts and tested on both Kindle 1 and Kindle 2.

The book formatting nicely follows verse structure as long as you adjust the font-size to level 1 or 2. At a greater font-size some lines may be split. Please download the Free demo to test formatting.

MobileReference",5.0,7.0,109,Books
7,Terse Evaluation,"""Take care my skirt don't trip you up..."" ""Don't Meg","""Take care my skirt don't trip you up...""

""Don't Meg pull fair?""

""Oh, yes she tries to but she don't love Bethy as I do...""

If you're looking for a copy of Little Women with lots of colorful illustrations don't buy this copy there are none.

If you're looking for a copy with extra information about the author don't buy this one there's only a very short paragraph at the end about Louisa May Alcott that comes after the 15 ""book discussion"" type questions that are not very useful to an independant reader.

I was not impressed with the wording of this Sterling Publishing edition of this beloved children's classic. I've read other editions of Little Women and don't remember the word don't being used so poorly throughout the novel as it was in this edition. Are these the original words of Louisa May Alcott or don't people know how to use proper English back in the 1860's?",2.0,5.0,158,Books
7,Terse Evaluation,Slow moving story line. Not one of her best books.,Slow moving story line.  Not one of her best books.  Kept reading and stopping as plot line could not hold my interest.  Plot was predictable.  Finally finished with dissappointment in the ending.,2.0,2.0,32,Books
7,Terse Evaluation,"These are great headphones, and extremely comfortable. But to add","These are great headphones, and extremely comfortable.  But to add real life into your music, especially out of the confines of the clasical genre, grab a pair of Sennheiser HD-600's...The sound those headphones create is near perfection.  They are often used as a reference for recording engineers, and audiophiles.  The extra [price] is very much worth it. ...these headphones are great for classical music, but if you are primarily a rock listner you might want to check out the Grado SR-325's.  I would also recommend going and auditioning this type of headphone before you buy.",3.0,10.0,95,Electronics
